[
 {
  "frame": 0,
  "x": 1135.8131864359864,
  "y": 1068.5288313975848,
  "confidence": 0.0,
  "uncertain": true,
  "source": "interpolated",
  "palm_w": 65.93162349935265
 },
 {
  "frame": 1,
  "x": 1135.8131864359864,
  "y": 1068.5288313975848,
  "confidence": 0.0,
  "uncertain": true,
  "source": "interpolated",
  "palm_w": 65.93162349935265
 },
 {
  "frame": 2,
  "x": 1135.8131864359864,
  "y": 1068.5288313975848,
  "confidence": 0.0,
  "uncertain": true,
  "source": "interpolated",
  "palm_w": 65.93162349935265
 },
 {
  "frame": 3,
  "x": 1135.8131864359864,
  "y": 1068.5288313975848,
  "confidence": 0.0,
  "uncertain": true,
  "source": "interpolated",
  "palm_w": 65.93162349935265
 },
 {
  "frame": 4,
  "x": 1135.8131864359864,
  "y": 1068.5288313975848,
  "confidence": 0.0,
  "uncertain": true,
  "source": "interpolated",
  "palm_w": 65.93162349935265
 },
 {
  "frame": 5,
  "x": 1135.8131864359864,
  "y": 1068.5288313975848,
  "confidence": 0.0,
  "uncertain": true,
  "source": "interpolated",
  "palm_w": 65.93162349935265
 },
 {
  "frame": 6,
  "x": 1135.8131864359864,
  "y": 1068.5288313975848,
  "confidence": 0.0,
  "uncertain": true,
  "source": "interpolated",
  "palm_w": 65.93162349935265
 },
 {
  "frame": 7,
  "x": 1135.8131864359864,
  "y": 1068.5288313975848,
  "confidence": 0.0,
  "uncertain": true,
  "source": "interpolated",
  "palm_w": 65.93162349935265
 },
 {
  "frame": 8,
  "x": 1135.8131864359864,
  "y": 1068.5288313975848,
  "confidence": 0.0,
  "uncertain": true,
  "source": "interpolated",
  "palm_w": 65.93162349935265
 },
 {
  "frame": 9,
  "x": 1135.8131864359864,
  "y": 1068.5288313975848,
  "confidence": 0.0,
  "uncertain": true,
  "source": "interpolated",
  "palm_w": 65.93162349935265
 },
 {
  "frame": 10,
  "x": 1135.8131864359864,
  "y": 1068.5288313975848,
  "confidence": 0.9920578002929688,
  "uncertain": false,
  "source": "tracked",
  "palm_w": 65.93162349935265
 },
 {
  "frame": 11,
  "x": 1138.1838609883303,
  "y": 1048.9318056950056,
  "confidence": 0.9934614896774292,
  "uncertain": false,
  "source": "tracked",
  "palm_w": 74.67194077067403
 },
 {
  "frame": 12,
  "x": 1156.5249112395222,
  "y": 964.7016832937386,
  "confidence": 0.0,
  "uncertain": false,
  "source": "interpolated",
  "palm_w": 82.37453741391477
 },
 {
  "frame": 13,
  "x": 1174.8659614907142,
  "y": 880.4715608924718,
  "confidence": 0.9925256371498108,
  "uncertain": false,
  "source": "tracked",
  "palm_w": 90.07713405715552
 },
 {
  "frame": 14,
  "x": 1178.341119823825,
  "y": 847.0175794763575,
  "confidence": 0.9954103231430054,
  "uncertain": false,
  "source": "tracked",
  "palm_w": 90.16023680323944
 },
 {
  "frame": 15,
  "x": 1180.9532382361745,
  "y": 801.4459344036391,
  "confidence": 0.9943615198135376,
  "uncertain": false,
  "source": "tracked",
  "palm_w": 91.55879522408328
 },
 {
  "frame": 16,
  "x": 1184.6085142201161,
  "y": 738.8015719830328,
  "confidence": 0.992808997631073,
  "uncertain": false,
  "source": "tracked",
  "palm_w": 80.5832555695489
 },
 {
  "frame": 17,
  "x": 1184.2839061408288,
  "y": 692.5402784992611,
  "confidence": 0.9932236075401306,
  "uncertain": false,
  "source": "tracked",
  "palm_w": 98.35382712908425
 },
 {
  "frame": 18,
  "x": 1184.9138324571413,
  "y": 662.9043211203697,
  "confidence": 0.9832631945610046,
  "uncertain": false,
  "source": "tracked",
  "palm_w": 94.25507375270955
 },
 {
  "frame": 19,
  "x": 1185.7539427636505,
  "y": 626.9987397532955,
  "confidence": 0.9889955520629883,
  "uncertain": false,
  "source": "tracked",
  "palm_w": 97.80522780446444
 },
 {
  "frame": 20,
  "x": 1187.8190512059928,
  "y": 608.3796794612748,
  "confidence": 0.9795404076576233,
  "uncertain": false,
  "source": "tracked",
  "palm_w": 92.8895547296603
 },
 {
  "frame": 21,
  "x": 1190.6373563853429,
  "y": 595.3678882362148,
  "confidence": 0.9846262335777283,
  "uncertain": false,
  "source": "tracked",
  "palm_w": 92.2886131801187
 },
 {
  "frame": 22,
  "x": 1193.9852022990613,
  "y": 584.0368318696919,
  "confidence": 0.9853036403656006,
  "uncertain": false,
  "source": "tracked",
  "palm_w": 92.97623319818366
 },
 {
  "frame": 23,
  "x": 1197.5465446031017,
  "y": 571.9599600473325,
  "confidence": 0.9829450845718384,
  "uncertain": false,
  "source": "tracked",
  "palm_w": 93.05135717015024
 },
 {
  "frame": 24,
  "x": 1199.5925276462444,
  "y": 566.6145668497333,
  "confidence": 0.9851938486099243,
  "uncertain": false,
  "source": "tracked",
  "palm_w": 94.13205828839841
 },
 {
  "frame": 25,
  "x": 1201.8135514084202,
  "y": 562.7212790065178,
  "confidence": 0.984420895576477,
  "uncertain": false,
  "source": "tracked",
  "palm_w": 95.45928778293418
 },
 {
  "frame": 26,
  "x": 1203.8379393879868,
  "y": 560.008449969443,
  "confidence": 0.9851294159889221,
  "uncertain": false,
  "source": "tracked",
  "palm_w": 95.03685560932345
 },
 {
  "frame": 27,
  "x": 1205.9255966801616,
  "y": 557.1398638721713,
  "confidence": 0.9832618832588196,
  "uncertain": false,
  "source": "tracked",
  "palm_w": 94.89971315297743
 },
 {
  "frame": 28,
  "x": 1207.2534432174793,
  "y": 556.3894978539403,
  "confidence": 0.9755734801292419,
  "uncertain": false,
  "source": "tracked",
  "palm_w": 95.06076783618822
 },
 {
  "frame": 29,
  "x": 1208.2437789822766,
  "y": 556.159081841362,
  "confidence": 0.9765229225158691,
  "uncertain": false,
  "source": "tracked",
  "palm_w": 96.2995773515565
 },
 {
  "frame": 30,
  "x": 1209.0046663203493,
  "y": 556.4911540503269,
  "confidence": 0.9728637933731079,
  "uncertain": false,
  "source": "tracked",
  "palm_w": 94.73611279241513
 },
 {
  "frame": 31,
  "x": 1209.5430134818184,
  "y": 556.6777484208136,
  "confidence": 0.9752902388572693,
  "uncertain": false,
  "source": "tracked",
  "palm_w": 94.48590780517995
 },
 {
  "frame": 32,
  "x": 1209.7412143279857,
  "y": 557.5816362358473,
  "confidence": 0.9709978699684143,
  "uncertain": false,
  "source": "tracked",
  "palm_w": 94.32604817955111
 },
 {
  "frame": 33,
  "x": 1209.9478876002827,
  "y": 558.5379275183066,
  "confidence": 0.9739911556243896,
  "uncertain": false,
  "source": "tracked",
  "palm_w": 93.35508038093685
 },
 {
  "frame": 34,
  "x": 1209.914886954773,
  "y": 560.2258176769167,
  "confidence": 0.9705631136894226,
  "uncertain": false,
  "source": "tracked",
  "palm_w": 93.80631386507942
 },
 {
  "frame": 35,
  "x": 1210.0734972599903,
  "y": 561.9754866016806,
  "confidence": 0.971039354801178,
  "uncertain": false,
  "source": "tracked",
  "palm_w": 91.86531033050981
 },
 {
  "frame": 36,
  "x": 1210.1685056581123,
  "y": 563.5434883595797,
  "confidence": 0.9745606780052185,
  "uncertain": false,
  "source": "tracked",
  "palm_w": 91.82763460867945
 },
 {
  "frame": 37,
  "x": 1210.270029157905,
  "y": 564.9796907374349,
  "confidence": 0.9670441746711731,
  "uncertain": false,
  "source": "tracked",
  "palm_w": 91.18703742723334
 },
 {
  "frame": 38,
  "x": 1209.7233827593968,
  "y": 566.8121024633978,
  "confidence": 0.9716486930847168,
  "uncertain": false,
  "source": "tracked",
  "palm_w": 93.13254877783739
 },
 {
  "frame": 39,
  "x": 1209.1966151717984,
  "y": 568.391326719297,
  "confidence": 0.9500942826271057,
  "uncertain": false,
  "source": "tracked",
  "palm_w": 89.62689522364889
 },
 {
  "frame": 40,
  "x": 1208.864209537817,
  "y": 570.3927859631929,
  "confidence": 0.9517810344696045,
  "uncertain": false,
  "source": "tracked",
  "palm_w": 90.0525935560812
 },
 {
  "frame": 41,
  "x": 1208.0673838754547,
  "y": 572.1058441227322,
  "confidence": 0.9024771451950073,
  "uncertain": false,
  "source": "tracked",
  "palm_w": 89.21615092584894
 },
 {
  "frame": 42,
  "x": 1207.786065999076,
  "y": 573.1480382465218,
  "confidence": 0.9421384334564209,
  "uncertain": false,
  "source": "tracked",
  "palm_w": 88.59478771891052
 },
 {
  "frame": 43,
  "x": 1206.8354054403922,
  "y": 573.8262252460845,
  "confidence": 0.8550311326980591,
  "uncertain": false,
  "source": "tracked",
  "palm_w": 85.95536561735537
 },
 {
  "frame": 44,
  "x": 1206.506010960438,
  "y": 574.7765207775715,
  "confidence": 0.9178578853607178,
  "uncertain": false,
  "source": "tracked",
  "palm_w": 88.12685414974074
 },
 {
  "frame": 45,
  "x": 1205.0121353777224,
  "y": 575.1236702232416,
  "confidence": 0.8772252202033997,
  "uncertain": false,
  "source": "tracked",
  "palm_w": 86.72175359567932
 },
 {
  "frame": 46,
  "x": 1205.1440436479736,
  "y": 575.6987930975193,
  "confidence": 0.8957558870315552,
  "uncertain": false,
  "source": "tracked",
  "palm_w": 84.77505387061964
 },
 {
  "frame": 47,
  "x": 1205.273541159463,
  "y": 575.0109460704039,
  "confidence": 0.8879404067993164,
  "uncertain": false,
  "source": "tracked",
  "palm_w": 84.76779814584731
 },
 {
  "frame": 48,
  "x": 1205.0262180219188,
  "y": 575.194422480638,
  "confidence": 0.9282469749450684,
  "uncertain": false,
  "source": "tracked",
  "palm_w": 85.29481158610741
 },
 {
  "frame": 49,
  "x": 1204.5390484357258,
  "y": 575.6628525435872,
  "confidence": 0.8543765544891357,
  "uncertain": false,
  "source": "tracked",
  "palm_w": 85.499966228558
 },
 {
  "frame": 50,
  "x": 1204.8230540934637,
  "y": 575.4922109467043,
  "confidence": 0.8264191150665283,
  "uncertain": false,
  "source": "tracked",
  "palm_w": 86.7215979184307
 },
 {
  "frame": 51,
  "x": 1204.6829269343407,
  "y": 575.8078021762077,
  "confidence": 0.8341928720474243,
  "uncertain": false,
  "source": "tracked",
  "palm_w": 86.44551728346214
 },
 {
  "frame": 52,
  "x": 1204.7624225174027,
  "y": 575.6768949503644,
  "confidence": 0.8451096415519714,
  "uncertain": false,
  "source": "tracked",
  "palm_w": 85.99580259807271
 },
 {
  "frame": 53,
  "x": 1204.5596574410438,
  "y": 576.3658245652143,
  "confidence": 0.900352418422699,
  "uncertain": false,
  "source": "tracked",
  "palm_w": 82.74689223875338
 },
 {
  "frame": 54,
  "x": 1204.933243528002,
  "y": 575.4853131603993,